{
  "frc_schema_version": "1.0.0",
  "sdb26_version": "SDB-26-v0.2",
  "verdict": "GENUINE",
  "verdict_confidence": 0.89,
  "sdb26_class": "GENUINE",
  "attack_level": "L1",
  "primary_codes": [],
  "supporting_codes": [],
  "required_action": "approve",
  "forensic_note": "No suspicious forensic indicators detected.",
  "model_trace": {
    "detector_version": "doclens-detector-0.9.3",
    "pipeline_id": "prod-eu-kyc-v2"
  },
  "decision_id": "dec-example-0003",
  "evaluated_at": "2026-04-24T18:32:00Z"
}
