{
  "frc_schema_version": "1.0.0",
  "sdb26_version": "SDB-26-v0.2",
  "verdict": "INSUFFICIENT",
  "verdict_confidence": 0.37,
  "sdb26_class": "INSUFFICIENT",
  "attack_level": "INF",
  "primary_codes": [
    {
      "code": "FRC-INF-LOW-RESOLUTION",
      "confidence": 0.93,
      "evidence_strength": "strong"
    }
  ],
  "supporting_codes": [
    {
      "code": "FRC-INF-MOTION-BLUR",
      "confidence": 0.66,
      "evidence_strength": "moderate"
    }
  ],
  "required_action": "recapture_required",
  "forensic_note": "Resolution too low for reliable forensic analysis.",
  "model_trace": {
    "detector_version": "doclens-detector-0.9.3",
    "pipeline_id": "prod-eu-kyc-v2"
  },
  "decision_id": "dec-0002",
  "evaluated_at": "2026-04-24T18:31:00Z"
}
